<?xml version="1.0" encoding="UTF-8"?>
<xs:schema xmlns:xs="http://www.w3.org/2001/XMLSchema" elementFormDefault="qualified" xmlns:xsi="http://www.w3.org/2001/XMLSchema-instance">
    <xs:element name="distribusi">
        <xs:complexType>
            <xs:sequence>
                <xs:element maxOccurs="unbounded" ref="barang"/>
            </xs:sequence>
        </xs:complexType>
    </xs:element>
    <xs:element name="barang">
        <xs:complexType>
            <xs:sequence>
                <xs:element ref="jenis"/>
                <xs:element ref="jumlah"/>
                <xs:element ref="harga"/>
                <xs:element ref="distributor"/>
                <xs:element ref="manajer"/>
            </xs:sequence>
        </xs:complexType>
    </xs:element>
    <xs:element name="jenis" type="xs:string"/>
    <xs:element name="jumlah" type="xs:integer"/>
    <xs:element name="harga" type="xs:integer"/>
    <xs:element name="distributor">
        <xs:complexType>
            <xs:sequence>
                <xs:element ref="pt"/>
                <xs:element ref="kode"/>
            </xs:sequence>
        </xs:complexType>
    </xs:element>
    <xs:element name="pt" type="xs:NCName"/>
    <xs:element name="kode" type="xs:integer"/>
    <xs:element name="manajer">
        <xs:complexType>
            <xs:sequence>
                <xs:element ref="nama"/>
                <xs:element ref="nomor"/>
            </xs:sequence>
        </xs:complexType>
    </xs:element>
    <xs:element name="nama" type="xs:NCName"/>
    <xs:element name="nomor" type="xs:integer"/>
</xs:schema>
